configs.json

{
  "bm-20251007-3.14.0-ebf955d/bm-20251007-centurion_clang22-x86_64-python-v3.14.0-3.14.0-ebf955d.json,bm-20251007-3.14.0-ebf955d-NOGIL/bm-20251007-centurion_clang22-x86_64-python-v3.14.0-3.14.0-ebf955d.json": 1.0639577941766796,
  "bm-20251007-3.14.0-ebf955d/bm-20251007-centurion_gcc15-x86_64-python-v3.14.0-3.14.0-ebf955d.json,bm-20251007-3.14.0-ebf955d-NOGIL/bm-20251007-centurion_gcc15-x86_64-python-v3.14.0-3.14.0-ebf955d.json": 1.0203255106279254,
  "bm-20251007-3.14.0-ebf955d/bm-20251007-centurion_gcc9-x86_64-python-v3.14.0-3.14.0-ebf955d.json,bm-20251007-3.14.0-ebf955d-NOGIL/bm-20251007-centurion_gcc9-x86_64-python-v3.14.0-3.14.0-ebf955d.json": 1.0135816047169341,
  "bm-20251007-3.14.0-ebf955d/bm-20251007-centurion_gcc9-x86_64-python-v3.14.0-3.14.0-ebf955d.json,bm-20251007-3.14.0-ebf955d/bm-20251007-centurion_clang22-x86_64-python-v3.14.0-3.14.0-ebf955d.json": 0.9634789382114737,
  "bm-20251007-3.14.0-ebf955d/bm-20251007-centurion_gcc9-x86_64-python-v3.14.0-3.14.0-ebf955d.json,bm-20251007-3.14.0-ebf955d/bm-20251007-centurion_gcc15-x86_64-python-v3.14.0-3.14.0-ebf955d.json": 0.9987730371142389,
  "bm-20251007-3.14.0-ebf955d/bm-20251007-centurion_gcc9-x86_64-python-v3.14.0-3.14.0-ebf955d.json,bm-20251007-3.14.0-ebf955d/bm-20251007-centurion_gcc9-x86_64-python-v3.14.0-3.14.0-ebf955d.json": 1.0,
  "bm-20260804-3.15.0rc1-37e98da/bm-20260804-centurion_clang22-x86_64-python-v3.15.0rc1-3.15.0rc1-37e98da.json,bm-20260804-3.15.0rc1-37e98da-NOGIL/bm-20260804-centurion_clang22-x86_64-python-v3.15.0rc1-3.15.0rc1-37e98da.json": 1.036480658177377,
  "bm-20260804-3.15.0rc1-37e98da/bm-20260804-centurion_gcc15-x86_64-python-v3.15.0rc1-3.15.0rc1-37e98da.json,bm-20260804-3.15.0rc1-37e98da-NOGIL/bm-20260804-centurion_gcc15-x86_64-python-v3.15.0rc1-3.15.0rc1-37e98da.json": 1.0397440614724036,
  "bm-20260804-3.15.0rc1-37e98da/bm-20260804-centurion_gcc9-x86_64-python-v3.15.0rc1-3.15.0rc1-37e98da.json,bm-20260804-3.15.0rc1-37e98da-NOGIL/bm-20260804-centurion_gcc9-x86_64-python-v3.15.0rc1-3.15.0rc1-37e98da.json": 1.0502343276170643,
  "bm-20260804-3.15.0rc1-37e98da/bm-20260804-centurion_gcc9-x86_64-python-v3.15.0rc1-3.15.0rc1-37e98da.json,bm-20260804-3.15.0rc1-37e98da/bm-20260804-centurion_clang22-x86_64-python-v3.15.0rc1-3.15.0rc1-37e98da.json": 0.9988936624938058,
  "bm-20260804-3.15.0rc1-37e98da/bm-20260804-centurion_gcc9-x86_64-python-v3.15.0rc1-3.15.0rc1-37e98da.json,bm-20260804-3.15.0rc1-37e98da/bm-20260804-centurion_gcc15-x86_64-python-v3.15.0rc1-3.15.0rc1-37e98da.json": 1.029629135422393,
  "bm-20260804-3.15.0rc1-37e98da/bm-20260804-centurion_gcc9-x86_64-python-v3.15.0rc1-3.15.0rc1-37e98da.json,bm-20260804-3.15.0rc1-37e98da/bm-20260804-centurion_gcc9-x86_64-python-v3.15.0rc1-3.15.0rc1-37e98da.json": 1.0,
  "bm-20260718-3.15.0b4-0a6fa62/bm-20260718-centurion_clang22-x86_64-python-v3.15.0b4-3.15.0b4-0a6fa62.json,bm-20260718-3.15.0b4-0a6fa62-NOGIL/bm-20260718-centurion_clang22-x86_64-python-v3.15.0b4-3.15.0b4-0a6fa62.json": 1.092509337883339,
  "bm-20260113-3.15.0a4-43cd277/bm-20260113-centurion_clang22-x86_64-python-v3.15.0a4-3.15.0a4-43cd277.json,bm-20260113-3.15.0a4-43cd277-NOGIL/bm-20260113-centurion_clang22-x86_64-python-v3.15.0a4-3.15.0a4-43cd277.json": 0.9486283332122177,
  "bm-20260113-3.15.0a4-43cd277/bm-20260113-centurion_gcc15-x86_64-python-v3.15.0a4-3.15.0a4-43cd277.json,bm-20260113-3.15.0a4-43cd277-NOGIL/bm-20260113-centurion_gcc15-x86_64-python-v3.15.0a4-3.15.0a4-43cd277.json": 1.0146520127334653,
  "bm-20260113-3.15.0a4-43cd277/bm-20260113-centurion_gcc9-x86_64-python-v3.15.0a4-3.15.0a4-43cd277.json,bm-20260113-3.15.0a4-43cd277-NOGIL/bm-20260113-centurion_gcc9-x86_64-python-v3.15.0a4-3.15.0a4-43cd277.json": 1.000368492793822,
  "bm-20260113-3.15.0a4-43cd277/bm-20260113-centurion_gcc9-x86_64-python-v3.15.0a4-3.15.0a4-43cd277.json,bm-20260113-3.15.0a4-43cd277/bm-20260113-centurion_clang22-x86_64-python-v3.15.0a4-3.15.0a4-43cd277.json": 1.0028211574675825,
  "bm-20260113-3.15.0a4-43cd277/bm-20260113-centurion_gcc9-x86_64-python-v3.15.0a4-3.15.0a4-43cd277.json,bm-20260113-3.15.0a4-43cd277/bm-20260113-centurion_gcc15-x86_64-python-v3.15.0a4-3.15.0a4-43cd277.json": 1.0040185307308909,
  "bm-20260113-3.15.0a4-43cd277/bm-20260113-centurion_gcc9-x86_64-python-v3.15.0a4-3.15.0a4-43cd277.json,bm-20260113-3.15.0a4-43cd277/bm-20260113-centurion_gcc9-x86_64-python-v3.15.0a4-3.15.0a4-43cd277.json": 1.0
}

results/bm-20260113-3.15.0a4-43cd277-JIT/README.md

### vs. 3.14.0

- Geometric mean: 1.077x faster (HPT: reliability of 100.00%, 1.01x faster at 99th %ile)
- Memory usage: 1.03x
- [🔍interactive time plot](https://yhg1s.github.io/thread-benchmarking/results/bm-20260113-3.15.0a4-43cd277-JIT/bm-20260113-centurion_clang22-x86_64-python-v3.15.0a4-3.15.0a4-43cd277-vs-3.14.0.html)
- [📄table](bm-20260113-centurion_clang22-x86_64-python-v3.15.0a4-3.15.0a4-43cd277-vs-3.14.0.md)
- [📈time plot](bm-20260113-centurion_clang22-x86_64-python-v3.15.0a4-3.15.0a4-43cd277-vs-3.14.0.svg)

### vs. base

- Geometric mean: 1.021x faster (HPT: reliability of 65.49%, 1.00x faster at 99th %ile)
- Memory usage: 1.02x
- [🔬interactive memory plot](https://yhg1s.github.io/thread-benchmarking/results/bm-20260113-3.15.0a4-43cd277-JIT/bm-20260113-centurion_clang22-x86_64-python-v3.15.0a4-3.15.0a4-43cd277-vs-base-mem.html)
- [🧠memory plot](bm-20260113-centurion_clang22-x86_64-python-v3.15.0a4-3.15.0a4-43cd277-vs-base-mem.svg)
- [🔍interactive time plot](https://yhg1s.github.io/thread-benchmarking/results/bm-20260113-3.15.0a4-43cd277-JIT/bm-20260113-centurion_clang22-x86_64-python-v3.15.0a4-3.15.0a4-43cd277-vs-base.html)
- [📄table](bm-20260113-centurion_clang22-x86_64-python-v3.15.0a4-3.15.0a4-43cd277-vs-base.md)
- [📈time plot](bm-20260113-centurion_clang22-x86_64-python-v3.15.0a4-3.15.0a4-43cd277-vs-base.svg)

### vs. 3.14.0

- Geometric mean: 1.059x faster (HPT: reliability of 99.99%, 1.01x faster at 99th %ile)
- Memory usage: 1.02x
- [🔍interactive time plot](https://yhg1s.github.io/thread-benchmarking/results/bm-20260113-3.15.0a4-43cd277-JIT/bm-20260113-centurion_gcc15-x86_64-python-v3.15.0a4-3.15.0a4-43cd277-vs-3.14.0.html)
- [📄table](bm-20260113-centurion_gcc15-x86_64-python-v3.15.0a4-3.15.0a4-43cd277-vs-3.14.0.md)
- [📈time plot](bm-20260113-centurion_gcc15-x86_64-python-v3.15.0a4-3.15.0a4-43cd277-vs-3.14.0.svg)

### vs. base

- Geometric mean: 1.036x faster (HPT: reliability of 99.89%, 1.00x faster at 99th %ile)
- Memory usage: 1.01x
- [🔬interactive memory plot](https://yhg1s.github.io/thread-benchmarking/results/bm-20260113-3.15.0a4-43cd277-JIT/bm-20260113-centurion_gcc15-x86_64-python-v3.15.0a4-3.15.0a4-43cd277-vs-base-mem.html)
- [🧠memory plot](bm-20260113-centurion_gcc15-x86_64-python-v3.15.0a4-3.15.0a4-43cd277-vs-base-mem.svg)
- [🔍interactive time plot](https://yhg1s.github.io/thread-benchmarking/results/bm-20260113-3.15.0a4-43cd277-JIT/bm-20260113-centurion_gcc15-x86_64-python-v3.15.0a4-3.15.0a4-43cd277-vs-base.html)
- [📄table](bm-20260113-centurion_gcc15-x86_64-python-v3.15.0a4-3.15.0a4-43cd277-vs-base.md)
- [📈time plot](bm-20260113-centurion_gcc15-x86_64-python-v3.15.0a4-3.15.0a4-43cd277-vs-base.svg)