longitudinal.json

{
  "bm-20241007-3.13.0-60403a5/bm-20241007-centurion_clang22-x86_64-python-v3.13.0-3.13.0-60403a5.json,bm-20251007-3.14.0-ebf955d/bm-20251007-centurion_clang22-x86_64-python-v3.14.0-3.14.0-ebf955d.json,3.13.0": 1.0292065924432843,
  "bm-20241007-3.13.0-60403a5/bm-20241007-centurion_clang22-x86_64-python-v3.13.0-3.13.0-60403a5.json,bm-20251007-3.14.0-ebf955d-NOGIL/bm-20251007-centurion_clang22-x86_64-python-v3.14.0-3.14.0-ebf955d.json,3.13.0": 1.094564053239565,
  "bm-20241007-3.13.0-60403a5/bm-20241007-centurion_gcc15-x86_64-python-v3.13.0-3.13.0-60403a5.json,bm-20251007-3.14.0-ebf955d/bm-20251007-centurion_gcc15-x86_64-python-v3.14.0-3.14.0-ebf955d.json,3.13.0": 1.0461599501258734,
  "bm-20241007-3.13.0-60403a5/bm-20241007-centurion_gcc9-x86_64-python-v3.13.0-3.13.0-60403a5.json,bm-20251007-3.14.0-ebf955d/bm-20251007-centurion_gcc9-x86_64-python-v3.14.0-3.14.0-ebf955d.json,3.13.0": 1.0326821872968457,
  "bm-20241007-3.13.0-60403a5/bm-20241007-centurion_gcc15-x86_64-python-v3.13.0-3.13.0-60403a5.json,bm-20251007-3.14.0-ebf955d-NOGIL/bm-20251007-centurion_gcc15-x86_64-python-v3.14.0-3.14.0-ebf955d.json,3.13.0": 1.0669401338564832,
  "bm-20241007-3.13.0-60403a5/bm-20241007-centurion_gcc9-x86_64-python-v3.13.0-3.13.0-60403a5.json,bm-20251007-3.14.0-ebf955d-NOGIL/bm-20251007-centurion_gcc9-x86_64-python-v3.14.0-3.14.0-ebf955d.json,3.13.0": 1.046853880488571,
  "bm-20241007-3.13.0-60403a5/bm-20241007-centurion_clang22-x86_64-python-v3.13.0-3.13.0-60403a5.json,bm-20260113-3.15.0a4-43cd277/bm-20260113-centurion_clang22-x86_64-python-v3.15.0a4-3.15.0a4-43cd277.json,3.13.0": 1.1227833537563827,
  "bm-20241007-3.13.0-60403a5/bm-20241007-centurion_clang22-x86_64-python-v3.13.0-3.13.0-60403a5.json,bm-20260804-3.15.0rc1-37e98da/bm-20260804-centurion_clang22-x86_64-python-v3.15.0rc1-3.15.0rc1-37e98da.json,3.13.0": 1.2220992967815707,
  "bm-20241007-3.13.0-60403a5/bm-20241007-centurion_gcc15-x86_64-python-v3.13.0-3.13.0-60403a5.json,bm-20260804-3.15.0rc1-37e98da/bm-20260804-centurion_gcc15-x86_64-python-v3.15.0rc1-3.15.0rc1-37e98da.json,3.13.0": 1.2383449899648038,
  "bm-20241007-3.13.0-60403a5/bm-20241007-centurion_gcc9-x86_64-python-v3.13.0-3.13.0-60403a5.json,bm-20260804-3.15.0rc1-37e98da/bm-20260804-centurion_gcc9-x86_64-python-v3.15.0rc1-3.15.0rc1-37e98da.json,3.13.0": 1.1874890920221,
  "bm-20241007-3.13.0-60403a5/bm-20241007-centurion_clang22-x86_64-python-v3.13.0-3.13.0-60403a5.json,bm-20260804-3.15.0rc1-37e98da-NOGIL/bm-20260804-centurion_clang22-x86_64-python-v3.15.0rc1-3.15.0rc1-37e98da.json,3.13.0": 1.2649672312842608,
  "bm-20241007-3.13.0-60403a5/bm-20241007-centurion_gcc15-x86_64-python-v3.13.0-3.13.0-60403a5.json,bm-20260804-3.15.0rc1-37e98da-NOGIL/bm-20260804-centurion_gcc15-x86_64-python-v3.15.0rc1-3.15.0rc1-37e98da.json,3.13.0": 1.2862851337836045,
  "bm-20241007-3.13.0-60403a5/bm-20241007-centurion_gcc9-x86_64-python-v3.13.0-3.13.0-60403a5.json,bm-20260804-3.15.0rc1-37e98da-NOGIL/bm-20260804-centurion_gcc9-x86_64-python-v3.15.0rc1-3.15.0rc1-37e98da.json,3.13.0": 1.2453597874814935,
  "bm-20241007-3.13.0-60403a5/bm-20241007-centurion_clang22-x86_64-python-v3.13.0-3.13.0-60403a5.json,bm-20260718-3.15.0b4-0a6fa62/bm-20260718-centurion_clang22-x86_64-python-v3.15.0b4-3.15.0b4-0a6fa62.json,3.13.0": 1.2430825171662525,
  "bm-20241007-3.13.0-60403a5/bm-20241007-centurion_gcc15-x86_64-python-v3.13.0-3.13.0-60403a5.json,bm-20260113-3.15.0a4-43cd277/bm-20260113-centurion_gcc15-x86_64-python-v3.15.0a4-3.15.0a4-43cd277.json,3.13.0": 1.1019539372245106,
  "bm-20241007-3.13.0-60403a5/bm-20241007-centurion_gcc9-x86_64-python-v3.13.0-3.13.0-60403a5.json,bm-20260113-3.15.0a4-43cd277/bm-20260113-centurion_gcc9-x86_64-python-v3.15.0a4-3.15.0a4-43cd277.json,3.13.0": 1.0800432247327265,
  "bm-20241007-3.13.0-60403a5/bm-20241007-centurion_clang22-x86_64-python-v3.13.0-3.13.0-60403a5.json,bm-20260113-3.15.0a4-43cd277-NOGIL/bm-20260113-centurion_clang22-x86_64-python-v3.15.0a4-3.15.0a4-43cd277.json,3.13.0": 1.0657230373100588,
  "bm-20241007-3.13.0-60403a5/bm-20241007-centurion_clang22-x86_64-python-v3.13.0-3.13.0-60403a5.json,bm-20260718-3.15.0b4-0a6fa62-NOGIL/bm-20260718-centurion_clang22-x86_64-python-v3.15.0b4-3.15.0b4-0a6fa62.json,3.13.0": 1.3573201849317105,
  "bm-20241007-3.13.0-60403a5/bm-20241007-centurion_gcc15-x86_64-python-v3.13.0-3.13.0-60403a5.json,bm-20260113-3.15.0a4-43cd277-NOGIL/bm-20260113-centurion_gcc15-x86_64-python-v3.15.0a4-3.15.0a4-43cd277.json,3.13.0": 1.1174501036040119,
  "bm-20241007-3.13.0-60403a5/bm-20241007-centurion_gcc9-x86_64-python-v3.13.0-3.13.0-60403a5.json,bm-20260113-3.15.0a4-43cd277-NOGIL/bm-20260113-centurion_gcc9-x86_64-python-v3.15.0a4-3.15.0a4-43cd277.json,3.13.0": 1.0796412200929004,
  "bm-20241007-3.13.0-60403a5/bm-20241007-centurion_clang22-x86_64-python-v3.13.0-3.13.0-60403a5.json,bm-20251118-3.15.0a2-a625628/bm-20251118-centurion_clang22-x86_64-python-v3.15.0a2-3.15.0a2-a625628.json,3.13.0": 1.0568177559083067,
  "bm-20241007-3.13.0-60403a5/bm-20241007-centurion_gcc15-x86_64-python-v3.13.0-3.13.0-60403a5.json,bm-20251118-3.15.0a2-a625628/bm-20251118-centurion_gcc15-x86_64-python-v3.15.0a2-3.15.0a2-a625628.json,3.13.0": 1.1068038888911735,
  "bm-20241007-3.13.0-60403a5/bm-20241007-centurion_gcc9-x86_64-python-v3.13.0-3.13.0-60403a5.json,bm-20251118-3.15.0a2-a625628/bm-20251118-centurion_gcc9-x86_64-python-v3.15.0a2-3.15.0a2-a625628.json,3.13.0": 1.0730438168416097,
  "bm-20241007-3.13.0-60403a5/bm-20241007-centurion_clang22-x86_64-python-v3.13.0-3.13.0-60403a5.json,bm-20251118-3.15.0a2-a625628-NOGIL/bm-20251118-centurion_clang22-x86_64-python-v3.15.0a2-3.15.0a2-a625628.json,3.13.0": 1.0799020312232765,
  "bm-20241007-3.13.0-60403a5/bm-20241007-centurion_gcc15-x86_64-python-v3.13.0-3.13.0-60403a5.json,bm-20251118-3.15.0a2-a625628-NOGIL/bm-20251118-centurion_gcc15-x86_64-python-v3.15.0a2-3.15.0a2-a625628.json,3.13.0": 1.1209624971433956,
  "bm-20241007-3.13.0-60403a5/bm-20241007-centurion_gcc9-x86_64-python-v3.13.0-3.13.0-60403a5.json,bm-20251118-3.15.0a2-a625628-NOGIL/bm-20251118-centurion_gcc9-x86_64-python-v3.15.0a2-3.15.0a2-a625628.json,3.13.0": 1.0901139901420132
}

results/bm-20251118-3.15.0a2-a625628/README.md

### vs. 3.13.0

- Geometric mean: 1.057x faster (HPT: reliability of 97.30%, 1.00x faster at 99th %ile)
- Memory usage: 1.11x
- missing benchmarks: networkx_connected_components, networkx_k_core, networkx_shortest_path
- [🔍interactive time plot](https://yhg1s.github.io/thread-benchmarking/results/bm-20251118-3.15.0a2-a625628/bm-20251118-centurion_clang22-x86_64-python-v3.15.0a2-3.15.0a2-a625628-vs-3.13.0.html)
- [📄table](bm-20251118-centurion_clang22-x86_64-python-v3.15.0a2-3.15.0a2-a625628-vs-3.13.0.md)
- [📈time plot](bm-20251118-centurion_clang22-x86_64-python-v3.15.0a2-3.15.0a2-a625628-vs-3.13.0.svg)

- Geometric mean: 1.107x faster (HPT: reliability of 100.00%, 1.04x faster at 99th %ile)
- Memory usage: 1.11x
- missing benchmarks: networkx_connected_components, networkx_k_core, networkx_shortest_path
- [🔍interactive time plot](https://yhg1s.github.io/thread-benchmarking/results/bm-20251118-3.15.0a2-a625628/bm-20251118-centurion_gcc15-x86_64-python-v3.15.0a2-3.15.0a2-a625628-vs-3.13.0.html)
- [📄table](bm-20251118-centurion_gcc15-x86_64-python-v3.15.0a2-3.15.0a2-a625628-vs-3.13.0.md)
- [📈time plot](bm-20251118-centurion_gcc15-x86_64-python-v3.15.0a2-3.15.0a2-a625628-vs-3.13.0.svg)

- Geometric mean: 1.073x faster (HPT: reliability of 99.98%, 1.00x faster at 99th %ile)
- Memory usage: 1.10x
- missing benchmarks: networkx_connected_components, networkx_k_core, networkx_shortest_path, sqlalchemy_imperative
- [🔍interactive time plot](https://yhg1s.github.io/thread-benchmarking/results/bm-20251118-3.15.0a2-a625628/bm-20251118-centurion_gcc9-x86_64-python-v3.15.0a2-3.15.0a2-a625628-vs-3.13.0.html)
- [📄table](bm-20251118-centurion_gcc9-x86_64-python-v3.15.0a2-3.15.0a2-a625628-vs-3.13.0.md)
- [📈time plot](bm-20251118-centurion_gcc9-x86_64-python-v3.15.0a2-3.15.0a2-a625628-vs-3.13.0.svg)